"DESCRIPTION","DURATION IN MS","NAME","PARENT SUITE","START TIME","STATUS","STOP TIME","SUB SUITE","SUITE","TEST CLASS","TEST METHOD"
"Test dropping rows with invalid values.","351","test_drop_invalid_rows","","Mon Jan 27 14:27:37 GMT 2025","passed","Mon Jan 27 14:27:37 GMT 2025","","test_customer_targets","",""
"Test replacing negative values in target columns with None.","356","test_handle_negative_values","","Mon Jan 27 14:27:37 GMT 2025","passed","Mon Jan 27 14:27:37 GMT 2025","","test_customer_targets","",""
"Test loading customer targets data.","1309","test_load_customer_targets_data","","Mon Jan 27 14:27:33 GMT 2025","passed","Mon Jan 27 14:27:35 GMT 2025","","test_customer_targets","",""
"Test cleaning the CUSTOMER_ID column.","2084","test_clean_customer_id","","Mon Jan 27 14:27:35 GMT 2025","passed","Mon Jan 27 14:27:37 GMT 2025","","test_customer_targets","",""
"Test renaming columns to lowercase.","36","test_rename_columns_to_lowercase","","Mon Jan 27 14:27:38 GMT 2025","passed","Mon Jan 27 14:27:38 GMT 2025","","test_customer_targets","",""
"Test cleaning and transforming customer targets data.","707","test_clean_customer_targets_data","","Mon Jan 27 14:27:38 GMT 2025","passed","Mon Jan 27 14:27:38 GMT 2025","","test_customer_targets","",""
