"DESCRIPTION","DURATION IN MS","NAME","PARENT SUITE","START TIME","STATUS","STOP TIME","SUB SUITE","SUITE","TEST CLASS","TEST METHOD"
"Integration test for the entire data cleaning pipeline.","103","test_clean_products_data_integration","","Wed Mar 12 10:55:04 GMT 2025","failed","Wed Mar 12 10:55:04 GMT 2025","","test_products","",""
"Test handling of invalid categories.","277","test_clean_products_data_invalid_categories","","Wed Mar 12 10:55:06 GMT 2025","failed","Wed Mar 12 10:55:06 GMT 2025","","test_products","",""
"Test removal of special characters from all columns.","182","test_clean_products_data_special_characters","","Wed Mar 12 10:55:09 GMT 2025","passed","Wed Mar 12 10:55:09 GMT 2025","","test_products","",""
"Test that product_id is correctly converted to integer.","348","test_clean_products_data_product_id_conversion","","Wed Mar 12 10:55:08 GMT 2025","failed","Wed Mar 12 10:55:09 GMT 2025","","test_products","",""
"Test that load_products_data correctly loads CSV data with the specified schema.","3333","test_load_products_data","","Wed Mar 12 10:55:00 GMT 2025","passed","Wed Mar 12 10:55:03 GMT 2025","","test_products","",""
"Test that columns are properly renamed.","89","test_clean_products_data_column_renaming","","Wed Mar 12 10:55:04 GMT 2025","passed","Wed Mar 12 10:55:04 GMT 2025","","test_products","",""
"Test handling of invalid product names.","246","test_clean_products_data_invalid_product_names","","Wed Mar 12 10:55:07 GMT 2025","failed","Wed Mar 12 10:55:07 GMT 2025","","test_products","",""
"Test that rows with nulls are properly filtered out.","179","test_clean_products_data_null_filtering","","Wed Mar 12 10:55:10 GMT 2025","failed","Wed Mar 12 10:55:11 GMT 2025","","test_products","",""
"Test trimming of whitespace in all columns.","185","test_clean_products_data_whitespace_trimming","","Wed Mar 12 10:55:10 GMT 2025","failed","Wed Mar 12 10:55:10 GMT 2025","","test_products","",""
